[
  {
    "id": "lookup",
    "version": "0.1.0",
    "download_url": "https://github.com/bike-outliner/example-extensions/releases/download/lookup-v0.1.0/lookup.bkext.zip",
    "min_api_version": "0.0.0",
    "description": "Dictionary and thesaurus lookup for selected words in the inspector sidebar",
    "author": "Jesse Grosjean",
    "url": "https://github.com/bike-outliner/example-extensions/tree/main/src/lookup.bkext"
  }
]
